{
  "schema": "hutchfinity-lane-receipt/v1",
  "receipt_id": "synthetic-lane-v1",
  "evidence_scope": "synthetic_test_only",
  "lane_id": "synthetic-lane",
  "profile": {
    "profile_id": "synthetic-profile",
    "revision": "test-v1",
    "sha256": "1111111111111111111111111111111111111111111111111111111111111111"
  },
  "source_commit": "314731f4a38d7c78ecb4ac3fe01ab6b90c3656a7",
  "source_files_and_hashes": [
    {
      "path": "scad/gridfinity/dental/build-stl.sh",
      "sha256": "b081030822c869457d6239b13059f6f949b830f35cc3fcebd4d8db2a7e0fdb39"
    },
    {
      "path": "scad/gridfinity/vendor/extended/gridfinity_basic_cup.scad",
      "sha256": "d73b7c55b3cc9a5e0aeb5271484ce34a66bd7747db038c80b2bcec5ce5fac932"
    }
  ],
  "output_hashes": [
    {
      "path": "scad/gridfinity/stl/bin-1x1x5h.stl",
      "sha256": "6007d83c8d3b6d295636100c70fcbfe5f063cebd910d06cfacd626bc4c6c0a7a"
    },
    {
      "path": "scad/gridfinity/stl/bin-3x3x10h.stl",
      "sha256": "7f1532ed7c25f168929273b1094602a2f15a07262623fa8358e49a0fae199845"
    },
    {
      "path": "scad/gridfinity/stl/bin-1x1x20h.stl",
      "sha256": "c876f6268a2ac6bbd0dcad2f2ba6f11bf8ea363fc08b6b563cc32339c2a3c826"
    }
  ],
  "source_output_link_state": "reproduced",
  "representative_artifacts": [
    {
      "role": "smallest_thin_wall",
      "sku": "bin-1x1x5h"
    },
    {
      "role": "multi_cell",
      "sku": "bin-3x3x10h"
    },
    {
      "role": "tallest",
      "sku": "bin-1x1x20h"
    }
  ],
  "functional_artifact": {
    "source_sha256": "2222222222222222222222222222222222222222222222222222222222222222",
    "output_sha256": "3333333333333333333333333333333333333333333333333333333333333333"
  },
  "checks": {
    "articulation": "pass",
    "dovetail_0_1mm": "pass",
    "base_engagement_release": "pass",
    "adjacent_mixed_fit": "pass",
    "wall_floor_integrity": "pass",
    "top_surface_solid_infill": "pass",
    "interface_dimensions": "pass",
    "material_profile_identity": "pass",
    "unattended_completion": "pass"
  },
  "workarounds": [],
  "result": "pass",
  "performed_at": "2026-09-25T00:00:00Z"
}
